{
  "schema_version": 1,
  "profile_id": "market-outcome",
  "version": 2,
  "role": "outcome",
  "decision": "Does the plugin produce trustworthy, decision-relevant market intelligence and experiments without overstating evidence?",
  "population": "Market research, opportunity assessment, and validation experiment requests across complete, sparse, and adversarial evidence. Apply each dimension only to cases where the visible request and subject contract make it applicable; a correct typed omission outside that scope is compliance, not missing output.",
  "model": "gpt-5.6-sol",
  "threshold": 0.95,
  "minimum_dimension": 3,
  "dimensions": [
    {"dimension_id": "evidence-quality", "description": "Claims are current, attributable, classified, triangulated where material, and contradiction-aware.", "weight": 0.2, "anchors": {"0": "Fabricated or unattributed claims.", "1": "Weak sources treated as fact.", "2": "Mixed source quality.", "3": "Trustworthy with minor omissions.", "4": "Decision-grade provenance, freshness, directness, and limits."}},
    {"dimension_id": "market-coverage", "description": "The output covers the decision-relevant pains, segments, alternatives, competitors, economics, buyers, and constraints.", "weight": 0.2, "anchors": {"0": "No useful market view.", "1": "Single superficial lane.", "2": "Material gaps.", "3": "Applicable coverage with minor gaps.", "4": "Focused, complete, and non-redundant coverage."}},
    {"dimension_id": "uncertainty-honesty", "description": "Inference, vendor claims, estimates, contradictions, gaps, and synthetic inputs retain their true evidence state.", "weight": 0.2, "anchors": {"0": "False certainty.", "1": "Material overclaiming.", "2": "Mixed labeling.", "3": "Honest with minor gaps.", "4": "Exact claim classes, scope, confidence, sensitivity, and gaps."}},
    {"dimension_id": "experiment-strength", "description": "Experiments are falsifiable, behavior-aligned, predeclared, bias-aware, and decision-linked.", "weight": 0.2, "anchors": {"0": "No valid test.", "1": "Vanity or leading proxy.", "2": "Partial experiment.", "3": "Decision-capable with minor gaps.", "4": "Minimal, ethical, instrumented, success/kill-bound test."}},
    {"dimension_id": "handoff-quality", "description": "Frozen evidence and results reach Product without turning into unauthorized requirements or decisions.", "weight": 0.2, "anchors": {"0": "Makes unsupported product decisions.", "1": "Vague handoff.", "2": "Partial identity or scope.", "3": "Actionable with minor gaps.", "4": "Digest-bound evidence, limits, invalidation, and terminal owner."}}
  ],
  "blindness": ["No acceptance threshold in judge packet", "No sealed expected labels", "No peer judgments", "No builder rationale"]
}
