{
  "schema_version": 1,
  "profile_id": "cascade-design-outcome-v2",
  "version": 2,
  "role": "outcome",
  "decision": "Does the plugin produce useful, evidence-bound design outcomes for the visible cases without crossing product, compliance, implementation, or acceptance authority?",
  "population": "All frozen qualification-v1 Cascade Design target outputs.",
  "model": "gpt-6-astra",
  "threshold": 0.95,
  "minimum_dimension": 3,
  "dimensions": [
    {
      "dimension_id": "route-and-scope",
      "description": "Correct skill selection and strict separation among mockup authoring, feature UX, accessibility, visual evidence, reusable design rules, product intent, and host implementation/acceptance.",
      "weight": 0.25,
      "anchors": {
        "0": "Most cases use the wrong owner or cross authority boundaries.",
        "1": "Several material routing or authority errors make outputs unsafe to use.",
        "2": "Primary routes are often right but recurring collisions or ownership gaps remain.",
        "3": "Routes and boundaries are correct with at most one minor, non-misleading omission.",
        "4": "Every case selects the precise owner, preserves all authority boundaries, and gives exact handoffs without overlap."
      }
    },
    {
      "dimension_id": "grounding-and-status",
      "description": "Source identities, conflicts, missing evidence, status, and uncertainty are handled honestly and traceably.",
      "weight": 0.25,
      "anchors": {
        "0": "Outputs invent facts, hide missing evidence, or claim unsupported success.",
        "1": "Material sources or gaps are omitted and status is frequently misleading.",
        "2": "Some grounding is present but important conflicts, absent inputs, or evidence classes blur.",
        "3": "Grounding and status are reliable with at most a minor traceability omission.",
        "4": "Every output binds the visible sources, preserves conflicts, exposes gaps/blockers, and never upgrades evidence or status."
      }
    },
    {
      "dimension_id": "design-completeness",
      "description": "The chosen skill covers applicable design concerns and actionable handoffs. Authoring binds real editable frames, inspected previews and capture conditions when available; read-only planning exposes missing artifacts without fabricating them. Candidate readiness never implies approval or implemented fidelity. The rebuilt process reuses one brief, chooses necessary phases, preserves inherited/default/open direction authority and full local reference applicability. It does not impose repeated interviews, forced fieldwork, extra global fact files or an upstream runtime.",
      "weight": 0.3,
      "anchors": {
        "0": "Artifacts are unusable or omit the core design problem.",
        "1": "Most required coverage and evidence planning is absent.",
        "2": "Artifacts address the main issue but omit several material states, checks, constraints, or recovery details.",
        "3": "Artifacts are actionable and substantially complete with at most one minor omission.",
        "4": "Every artifact is concise, schema-coherent, skill-complete, evidence-specific, and gives closed recovery or next-gate detail."
      }
    },
    {
      "dimension_id": "safety-and-usability",
      "description": "Outputs preserve host-owned production integration and acceptance; authorized isolated presentation prototypes remain allowed. Results are non-attesting, privacy-aware and practical for the target owner. Failed tools/silence never authorize a choice; explicit prior delegation persists. Source examples/category datasets cannot invent product facts or automatic external operations. Criteria-specific accessibility, observed visuals, synthetic fixtures and participant outcomes remain distinct.",
      "weight": 0.2,
      "anchors": {
        "0": "Outputs create material safety, privacy, compliance, or mutation risk.",
        "1": "Several unsafe claims or unauthorized actions remain.",
        "2": "Boundaries are mentioned but inconsistently applied or outputs are hard to act on.",
        "3": "Outputs are safe and usable with at most a minor wording or handoff weakness.",
        "4": "Every output is safely bounded, avoids sensitive persistence and false attestation, and is immediately usable by the named next owner."
      }
    }
  ],
  "blindness": [
    "expected_status",
    "oracle",
    "mechanical_assertions",
    "threshold",
    "minimum_dimension",
    "peer_judgments",
    "builder_context"
  ]
}
