{
  "schema_version": 1,
  "profile_id": "cascade-design-trajectory-v2",
  "version": 3,
  "role": "trajectory",
  "decision": "Does the observed response trajectory follow the governing Design skill contracts from evidence through coverage, classification, handoff, and stop conditions?",
  "population": "All frozen qualification-v1 Cascade Design target outputs.",
  "model": "gpt-6-astra",
  "threshold": 0.95,
  "minimum_dimension": 3,
  "dimensions": [
    {
      "dimension_id": "source-discipline",
      "description": "The trajectory binds available sources, treats inputs as evidence, preserves conflict, and stops instead of inventing missing authority. Reuses the current brief and distinguishes actual evidence, contradiction, assumptions and subordinate dataset suggestions. Silence/tool failure never grants authority. Research findings retain actual sample/context, contradictions and uncertainty; qualitative reports cannot become unmeasured population rates, abandonment or causal proof for decisiveness.",
      "weight": 0.25,
      "anchors": {
        "0": "The trajectory follows untrusted instructions or invents governing facts.",
        "1": "Source handling is materially unreliable across multiple cases.",
        "2": "Some sources are bound but important authority, freshness, conflict, or missing-input handling is absent.",
        "3": "Source handling is disciplined with at most one minor omission.",
        "4": "Every trajectory binds source identity and authority, preserves conflict, and uses GAP/BLOCKED exactly when required."
      }
    },
    {
      "dimension_id": "procedure-coverage",
      "description": "The trajectory executes the selected skill's applicable workflow rather than returning a generic design checklist. Applies necessary intake, research/IA, direction, prototype and review phases proportionately. A settled correction skips re-interview and open direction; substantial open work uses grounded structural alternatives and full local topic procedures without an upstream runtime. Routes control/form/prototype work to actual applicable procedures; visual direction does not supply calculator models, category scoring or pricing-copy promises. Missing Product/Marketing truth stays explicit.",
      "weight": 0.3,
      "anchors": {
        "0": "The selected workflow is not meaningfully executed.",
        "1": "Most skill-specific steps or observable evidence are absent.",
        "2": "The main procedure appears but several material checks or states are skipped.",
        "3": "The applicable procedure is substantially complete with at most one minor omission.",
        "4": "Every case performs the exact applicable procedure, disposes non-applicable checks explicitly, and binds findings to evidence."
      }
    },
    {
      "dimension_id": "ownership-transitions",
      "description": "Cross-skill and cross-plugin transitions preserve producer/consumer contracts and never duplicate or seize authority. Keeps one brief/handoff, accepted target/default/selected-direction scope and host-owned effects. Actual preview evidence is prepared before review; no unsupported direct typed edge, duplicate MASTER truth, forced fieldwork or installation.",
      "weight": 0.25,
      "anchors": {
        "0": "Transitions are missing or routinely cross ownership boundaries.",
        "1": "Several handoffs are wrong, vague, or unauthorized.",
        "2": "Primary ownership is usually right but inputs/outputs or stop conditions are incomplete.",
        "3": "Handoffs are correct and usable with at most one minor contract omission.",
        "4": "Every transition names the precise route, reason, required input, expected output, status, and stop/resume boundary without copying peer behavior."
      }
    },
    {
      "dimension_id": "output-discipline",
      "description": "The trajectory ends in a concise, internally coherent typed artifact with explicit evidence, recovery, and false authority flags. Binds actual editable/capture revisions and finite recovery; keeps creation readiness, review readiness, evidence-check status, owner approval and target outcomes distinct. No invented frames, universal image percentage or compliance score.",
      "weight": 0.2,
      "anchors": {
        "0": "Outputs are malformed, contradictory, or omit terminal state.",
        "1": "Frequent structural or recovery gaps make outputs unreliable.",
        "2": "Artifacts are readable but contain recurring ambiguity, verbosity, or incomplete recovery.",
        "3": "Artifacts are coherent and concise with at most one minor output defect.",
        "4": "Every artifact is precise, compact, internally consistent, evidence-bound, and closes with an executable next owner or justified stop."
      }
    }
  ],
  "blindness": [
    "expected_status",
    "oracle",
    "mechanical_assertions",
    "threshold",
    "minimum_dimension",
    "peer_judgments",
    "builder_context"
  ]
}
